[
  {
    "id": "mastodon:https://fosstodon.org/@LPI/117066112976618964",
    "platform": "mastodon",
    "url": "https://fosstodon.org/@LPI/117066112976618964",
    "author": "LPI@fosstodon.org",
    "author_name": "Linux Professional Institute",
    "author_url": "https://fosstodon.org/@LPI",
    "posted": "2026-08-09T14:52:04.000Z",
    "excerpt": "Meaningful # opensource work doesn't happen in isolation. 🌍🐧 The UN Tech Over Hackathon, the opening event of UN Open Source Week 2026, showed how collaboration drives impact, with Linux Professional Institute (LPI) helping connect stakeholders across the FOSS ecosystem. Read th…",
    "hashtags": [
      "foss",
      "hackathon",
      "lpi",
      "opensource",
      "osposforgood",
      "un",
      "unopensourceweek",
      "untechoverhackathon"
    ],
    "retrieved": "2026-08-24",
    "method": "automated-ingestion"
  },
  {
    "id": "mastodon:https://fosstodon.org/@LPI/117032479751014771",
    "platform": "mastodon",
    "url": "https://fosstodon.org/@LPI/117032479751014771",
    "author": "LPI@fosstodon.org",
    "author_name": "Linux Professional Institute",
    "author_url": "https://fosstodon.org/@LPI",
    "posted": "2026-08-03T16:18:41.000Z",
    "excerpt": "Four Days. Four Venues. One Goal. 🌍🐧 The UN Tech Over Hackathon showed how # opensource thrives through collaboration among governments, # UN entities, academia, industry, and the global community. Learn more from Linux Professional Institute (LPI)’s Elzbieta Godlewska: https://…",
    "hashtags": [
      "foss",
      "hackathon",
      "lpi",
      "opensource",
      "osposforgood",
      "un",
      "unopensourceweek",
      "untechoverhackathon"
    ],
    "retrieved": "2026-08-24",
    "method": "automated-ingestion"
  },
  {
    "id": "mastodon:https://mastodon.social/@amazeeai/117003807868579366",
    "platform": "mastodon",
    "url": "https://mastodon.social/@amazeeai/117003807868579366",
    "author": "amazeeai",
    "author_name": "amazee.ai",
    "author_url": "https://mastodon.social/@amazeeai",
    "posted": "2026-07-29T14:47:03.781Z",
    "excerpt": "AI models are good enough. The real enterprise AI bottlenecks are # AIGovernance , # AISovereignty , and vendor lock-in. 🌐 Our AI Ambassador, Matthew Saunders, attended # UNOpenSourceWeek and brought back crucial lessons on why scaling AI safely requires moving beyond \"claims-ba…",
    "hashtags": [
      "aigovernance",
      "aiinfrastructure",
      "aisovereignty",
      "unopensourceweek"
    ],
    "retrieved": "2026-08-24",
    "method": "automated-ingestion"
  },
  {
    "id": "mastodon:https://fosstodon.org/@LPI/116969901825855144",
    "platform": "mastodon",
    "url": "https://fosstodon.org/@LPI/116969901825855144",
    "author": "LPI@fosstodon.org",
    "author_name": "Linux Professional Institute",
    "author_url": "https://fosstodon.org/@LPI",
    "posted": "2026-07-23T15:04:18.000Z",
    "excerpt": "Linux Professional Institute (LPI) participated in the UN Tech Over Hackathon, the opening event of UN Open Source Week 2026, as a co-organizer and sponsor. 🌍🐧 Read Elzbieta Godlewska’s recap of the event 👇 https:// lpi.org/ki9x # UN # UNopensourceweek # hackathon # UNTechOverHa…",
    "hashtags": [
      "foss",
      "hackathon",
      "lpi",
      "opensource",
      "osposforgood",
      "un",
      "unopensourceweek",
      "untechoverhackathon"
    ],
    "retrieved": "2026-08-24",
    "method": "automated-ingestion"
  },
  {
    "id": "mastodon:https://fosstodon.org/@LPI/116918776149796733",
    "platform": "mastodon",
    "url": "https://fosstodon.org/@LPI/116918776149796733",
    "author": "LPI@fosstodon.org",
    "author_name": "Linux Professional Institute",
    "author_url": "https://fosstodon.org/@LPI",
    "posted": "2026-07-14T14:22:22.000Z",
    "excerpt": "Meaningful # opensource work doesn't happen in isolation. 🌍🐧 The UN Tech Over Hackathon, the opening event of UN Open Source Week 2026, showed how collaboration drives impact, with Linux Professional Institute (LPI) helping connect stakeholders across the FOSS ecosystem. Read th…",
    "hashtags": [
      "foss",
      "hackathon",
      "lpi",
      "opensource",
      "un",
      "unopensourceweek",
      "untechoverhackathon"
    ],
    "retrieved": "2026-08-24",
    "method": "automated-ingestion"
  },
  {
    "id": "mastodon:https://mstdn.social/@swheritage/116885925034311849",
    "platform": "mastodon",
    "url": "https://mstdn.social/@swheritage/116885925034311849",
    "author": "swheritage@mstdn.social",
    "author_name": "Software Heritage",
    "author_url": "https://mstdn.social/@swheritage",
    "posted": "2026-07-08T19:07:54.000Z",
    "excerpt": "Software Heritage at UN Open Source Week 2026 https://www. softwareheritage.org/2026/07/0 8/software-heritage-un-open-source-week-2026/ # FOSS # UNOSW",
    "hashtags": [
      "foss",
      "unosw"
    ],
    "retrieved": "2026-07-13",
    "method": "automated-ingestion"
  },
  {
    "id": "mastodon:https://mastodon.social/@amazeeai/116874750445130068",
    "platform": "mastodon",
    "url": "https://mastodon.social/@amazeeai/116874750445130068",
    "author": "amazeeai",
    "author_name": "amazee.ai",
    "author_url": "https://mastodon.social/@amazeeai",
    "posted": "2026-07-06T19:46:03.791Z",
    "excerpt": "# UNOpenSourceWeek revealed 3 critical AI problems enterprises face: → Claims-based AI: No verification of where your data goes → Vendor lock-in: Single-provider APIs create massive risk → Governance gaps: The \"harness\" matters more than the model Our Private # AIAPIGateway solv…",
    "hashtags": [
      "aiapigateway",
      "unopensourceweek"
    ],
    "retrieved": "2026-07-13",
    "method": "automated-ingestion"
  },
  {
    "id": "mastodon:https://mastodon.social/@amazeeio/116874239261411502",
    "platform": "mastodon",
    "url": "https://mastodon.social/@amazeeio/116874239261411502",
    "author": "amazeeio",
    "author_name": "amazee.io",
    "author_url": "https://mastodon.social/@amazeeio",
    "posted": "2026-07-06T17:36:03.752Z",
    "excerpt": "# UNOpenSourceWeek revealed 3 critical # AI problems enterprises face: → Claims-based AI: No verification of where your data goes → Vendor lock-in: Single-provider APIs create massive risk → Governance gaps: The \"harness\" matters more than the model The @ amazeeai Private # AIAP…",
    "hashtags": [
      "ai",
      "aiapigateway",
      "unopensourceweek"
    ],
    "retrieved": "2026-07-13",
    "method": "automated-ingestion"
  },
  {
    "id": "mastodon:https://mastodon.social/@sovtechfund/116856150754252305",
    "platform": "mastodon",
    "url": "https://mastodon.social/@sovtechfund/116856150754252305",
    "author": "sovtechfund",
    "author_name": "Sovereign Tech Agency",
    "author_url": "https://mastodon.social/@sovtechfund",
    "posted": "2026-07-03T12:55:55.018Z",
    "excerpt": "We brought a unique perspective, shaped by our role as the leading public institution in Europe dedicated to investing in critical digital infrastructure. Making our approach accessible so that other institutions can adapt and build upon it when considering their own initiatives…",
    "hashtags": [
      "maintainathon",
      "publicdigitalinfrastructure",
      "unopensourceweek"
    ],
    "retrieved": "2026-07-06",
    "method": "automated-ingestion"
  },
  {
    "id": "mastodon:https://mastodon.social/@regento/116839627436527783",
    "platform": "mastodon",
    "url": "https://mastodon.social/@regento/116839627436527783",
    "author": "regento",
    "author_name": "Regento",
    "author_url": "https://mastodon.social/@regento",
    "posted": "2026-06-30T14:53:49.200Z",
    "excerpt": "The United Nations Open Source Week 2026 has ended, we look forward to next year! # UNOpenSourceWeek # OpenSourceUnited # UnitedNations # OpenSource",
    "hashtags": [
      "opensource",
      "opensourceunited",
      "unitednations",
      "unopensourceweek"
    ],
    "retrieved": "2026-07-06",
    "method": "automated-ingestion"
  },
  {
    "id": "mastodon:https://mastodon.social/@sovtechfund/116838353259459243",
    "platform": "mastodon",
    "url": "https://mastodon.social/@sovtechfund/116838353259459243",
    "author": "sovtechfund",
    "author_name": "Sovereign Tech Agency",
    "author_url": "https://mastodon.social/@sovtechfund",
    "posted": "2026-06-30T09:29:46.807Z",
    "excerpt": "# IGF2026 # UNOpenSourceWeek # OpenSource # DigitalPublicGoods # OpenStandards # DigitalInfrastructure # InternetGovernance # DigitalCommons (6/6)",
    "hashtags": [
      "digitalcommons",
      "digitalinfrastructure",
      "digitalpublicgoods",
      "igf2026",
      "internetgovernance",
      "opensource",
      "openstandards",
      "unopensourceweek"
    ],
    "retrieved": "2026-07-06",
    "method": "automated-ingestion"
  },
  {
    "id": "mastodon:https://mastodon.social/@sovtechfund/116838341551647646",
    "platform": "mastodon",
    "url": "https://mastodon.social/@sovtechfund/116838341551647646",
    "author": "sovtechfund",
    "author_name": "Sovereign Tech Agency",
    "author_url": "https://mastodon.social/@sovtechfund",
    "posted": "2026-06-30T09:26:48.158Z",
    "excerpt": "# UNOpenSourceWeek has been a timely moment to discuss how open source software, open standards, and digital public goods can be better governed, funded, and sustained as shared digital infrastructure. We’re therefore very pleased that the Internet Governance Forum’s Multistakeh…",
    "hashtags": [
      "unopensourceweek"
    ],
    "retrieved": "2026-07-06",
    "method": "automated-ingestion"
  },
  {
    "id": "mastodon:https://fed.brid.gy/r/https://bsky.app/profile/did:plc:rbc5qboqtdfylqz2aylrdaon/post/3mpco2p7kfc26",
    "platform": "mastodon",
    "url": "https://fed.brid.gy/r/https://bsky.app/profile/did:plc:rbc5qboqtdfylqz2aylrdaon/post/3mpco2p7kfc26",
    "author": "ox.ca@bsky.brid.gy",
    "author_name": "Mike Gifford, CPWA",